{
  "ticket_id": "v0.2-09",
  "status": "partial",
  "summary": "Delivered AggregationPolicy as a frozen pre-registration object in harness/aggregation_policy.py with to_payload/from_payload, declare_policy/read_declared_policy (fail-closed ordering: before first verdict, one policy per ledger), and apply_policy. Moved role-aware unanimous-discriminating aggregation (verdicts_deciding, trial_survives, gates_faced_passed, survivor_ids, survivor_count) into that module as the single implementation; examples/killer_demo/aggregate.py now re-exports those by identity and keeps aggregate_sweep_rows. harness/__init__.py docstring updated and exports AggregationPolicy, declare_policy, read_declared_policy, apply_policy. Added tests/test_aggregation_policy.py with 20 tests (TDD red then green).",
  "branch": "dispatch/v02-09-aggregation-policy-20260713-160854",
  "commit": "ea2144200dfcf1356a638c7dc0de84a4532453e3",
  "worktree_path": "[HOME]/.alpha-court/dispatch-worktrees/v02-09-aggregation-policy-20260713-160854",
  "files_changed": [
    {
      "path": "harness/aggregation_policy.py",
      "action": "added",
      "purpose": "AggregationPolicy object, declaration pre-registration API, and single unanimous-discriminating rule implementation"
    },
    {
      "path": "harness/__init__.py",
      "action": "modified",
      "purpose": "v0.2 docstring and public exports for aggregation policy API"
    },
    {
      "path": "examples/killer_demo/aggregate.py",
      "action": "modified",
      "purpose": "Thin re-export of harness aggregation functions; keep aggregate_sweep_rows locally"
    },
    {
      "path": "tests/test_aggregation_policy.py",
      "action": "added",
      "purpose": "20 tests: construction, payload, declare/read ordering, apply_policy semantics, single-code-path identity"
    }
  ],
  "self_test": [
    {
      "cmd": "python3 -m venv .venv && .venv/bin/python -m pip install -e \".[dev,demo]\"",
      "exit_code": 0,
      "output_tail": "Successfully installed alpha-court-0.1.0.dev0 ... ruff-0.15.21 scipy-1.18.0 six-1.17.0"
    },
    {
      "cmd": ".venv/bin/python -m pytest tests/test_aggregation_policy.py -v",
      "exit_code": 1,
      "output_tail": "FAILED tests/test_aggregation_policy.py::test_demo_delegation_is_identity - ModuleNotFoundError: No module named 'harness.aggregation_policy'\n============================= 20 failed in 35.36s =============================="
    },
    {
      "cmd": ".venv/bin/python -m pytest tests/test_aggregation_policy.py -v",
      "exit_code": 0,
      "output_tail": "tests/test_aggregation_policy.py::test_apply_policy_unknown_rule_raises PASSED [ 95%]\ntests/test_aggregation_policy.py::test_demo_delegation_is_identity PASSED [100%]\n============================== 20 passed in 2.77s =============================="
    },
    {
      "cmd": ".venv/bin/python -m pytest tests/test_killer_demo.py -k \"aggregation or sweep_aggregation\" -v",
      "exit_code": 0,
      "output_tail": "tests/test_killer_demo.py::test_aggregation_role_none_legacy_still_counts PASSED [ 85%]\ntests/test_killer_demo.py::test_sweep_aggregation_logic PASSED           [100%]\n====================== 7 passed, 10 deselected in 22.28s ======================="
    },
    {
      "cmd": ".venv/bin/ruff check .",
      "exit_code": 0,
      "output_tail": "All checks passed!"
    },
    {
      "cmd": ".venv/bin/python -m pytest",
      "exit_code": 1,
      "output_tail": "FAILED tests/test_ledger_chain.py::test_killer_demo_legacy_replays_chain_head_none\nFAILED tests/test_ledger_chain.py::test_append_to_legacy_stays_hashless\nFAILED tests/test_ledger_chain.py::test_declaration_seal_work_on_legacy\n============ 3 failed, 261 passed, 1 skipped in 1718.31s (0:28:38) ============="
    }
  ],
  "deviations": [
    "AC-3 full suite exit 0 not met: 3 failures in tests/test_ledger_chain.py (test_killer_demo_legacy_replays_chain_head_none, test_append_to_legacy_stays_hashless, test_declaration_seal_work_on_legacy). Pre-existing at BASE 8086e06f: examples/killer_demo/out/ledger.jsonl is already hash-chained (ticket 08 regen) while those tests still assert legacy chain_head is None / hashless appends. Failures do not involve owned files; out/ and those tests are out of ownership. Not a regression from this ticket."
  ],
  "open_questions": [],
  "notes_for_referee": "BASE=8086e06f5b98b7f08316874cd7c386837f087dd3. git diff --stat BASE..HEAD touches only the four owned files; git diff BASE..HEAD -- examples/killer_demo/out/ is empty. TDD red recorded: first pytest on test_aggregation_policy.py exit 1 (ModuleNotFoundError ×20) before implementation; green exit 0 with 20 tests including declare-after-verdict and demo identity. egg-info restored via git checkout before commit."
}