{
  "ticket_id": "v0.1-08c",
  "status": "done",
  "summary": "Implemented court/pbo.py with PboResult and pbo_cscv per Bailey et al. (2017) Alg. 2.3 / pbo-cscv.md §3: contiguous S blocks, itertools.combinations IS halves, midranks, smallest-index IS-best, λ=ln(ω̄/(1-ω̄)), φ = #{λ<0}/C(S,S/2). tests/test_pbo.py covers the §5 S=4 mean-metric fixture (positional logits, phi=0.5) plus fail-closed guards (ndim, non-finite values, N<2, odd/S<2, T%S≠0, non-finite metric). TDD: tests written first (red ImportError), then implementation to green.",
  "branch": "dispatch/v01-08c-pbo-20260710-220557",
  "commit": "82a0ec47ac4522199fda61c869f01b3d9ca8e79c",
  "worktree_path": "[HOME]/.alpha-court/dispatch-worktrees/v01-08c-pbo-20260710-220557",
  "files_changed": [
    {
      "path": "court/pbo.py",
      "action": "added",
      "purpose": "PboResult NamedTuple and pbo_cscv pure function (CSCV/PBO)"
    },
    {
      "path": "tests/test_pbo.py",
      "action": "added",
      "purpose": "§5 fixture logits/phi assertions and fail-closed guard tests"
    }
  ],
  "self_test": [
    {
      "cmd": "python3 -m venv .venv && .venv/bin/python -m pip install -e \".[dev]\"",
      "exit_code": 0,
      "output_tail": "Successfully installed alpha-court-0.1.0.dev0 iniconfig-2.3.0 numpy-2.5.1 packaging-26.2 pandas-3.0.3 pluggy-1.6.0 pygments-2.20.0 pytest-9.1.1 python-dateutil-2.9.0.post0 ruff-0.15.21 scipy-1.18.0 six-1.17.0"
    },
    {
      "cmd": ".venv/bin/python -m pytest tests/test_pbo.py -v",
      "exit_code": 0,
      "output_tail": "tests/test_pbo.py::test_guard_non_finite_metric_raises_whole_run PASSED  [100%]\n============================== 8 passed in 0.61s ==============================="
    },
    {
      "cmd": ".venv/bin/python -m pytest",
      "exit_code": 0,
      "output_tail": "tests/test_pbo.py ........                                               [ 80%]\ntests/test_smoke.py ..                                                   [100%]\n============================== 10 passed in 0.87s =============================="
    },
    {
      "cmd": ".venv/bin/ruff check .",
      "exit_code": 0,
      "output_tail": "All checks passed!"
    },
    {
      "cmd": ".venv/bin/python -c \"import numpy as np; from court.pbo import pbo_cscv; M = np.array([[3,0,4],[3,2,1],[3,4,6],[3,1,5],[4,4,0],[2,5,5],[3,5,5],[2,6,2]], dtype=float); r = pbo_cscv(M, 4, lambda c: float(np.mean(c))); assert r.phi == 0.5 and r.n_combinations == 6, r\"",
      "exit_code": 0,
      "output_tail": "SMOKE_OK PboResult(phi=0.5, logits=(0.0, -1.0986122886681098, 0.0, 0.0, -1.0986122886681098, -1.0986122886681098), n_combinations=6, n_lambda_negative=3)"
    },
    {
      "cmd": "git show --stat HEAD",
      "exit_code": 0,
      "output_tail": " court/pbo.py      | 161 ++++++++++++++++++++++++++++++++++++++++++++++++++++++\n tests/test_pbo.py | 122 +++++++++++++++++++++++++++++++++++++++++\n 2 files changed, 283 insertions(+)"
    },
    {
      "cmd": "git status --porcelain",
      "exit_code": 0,
      "output_tail": ""
    }
  ],
  "deviations": [],
  "open_questions": [],
  "notes_for_referee": "TDD: tests/test_pbo.py committed after red ImportError, then court/pbo.py to green. Fixture logits match pbo-cscv.md §5.4 positionally under itertools.combinations(range(4), 2). Operational φ uses strict λ<0 (three zeros in fixture do not count). court/__init__.py untouched."
}