{
  "ticket_id": "v0.2-14",
  "status": "partial",
  "summary": "Rewrote court.sharpe.sharpe_ratio to compute μ̂/σ̂ via mean and Bessel std only (same validation and σ̂==0 raise as before), without calling series_moments so skew/kurtosis are not computed on the PBO metric path. series_moments, DSR/PSR, judge registry, and pbo_cscv were left untouched. Added tests/test_sharpe_perf.py for bit-identity, raise preservation, PBO φ-invariance vs a local mean/std metric, and a <5s judge-driven PBO wall-time bound; added a lean-path source check in tests/test_sharpe.py. Measured PBO (T=480,N=100,n_splits=12 via judge) ≈ 2.08 s.",
  "branch": "dispatch/v02-14-sharpe-lean-20260718-021233",
  "commit": "06671a41ad1672e6fe2e683915d3f87e9f7dbad0",
  "worktree_path": "[HOME]/.alpha-court/dispatch-worktrees/v02-14-sharpe-lean-20260718-021233",
  "files_changed": [
    {
      "path": "court/sharpe.py",
      "action": "modified",
      "purpose": "Lean sharpe_ratio: mean + Bessel std only; drop series_moments route"
    },
    {
      "path": "tests/test_sharpe.py",
      "action": "modified",
      "purpose": "TDD lean-path source assertion (body must not call series_moments)"
    },
    {
      "path": "tests/test_sharpe_perf.py",
      "action": "added",
      "purpose": "Bit-identity, raise cases, PBO φ-invariance, PBO <5s performance"
    }
  ],
  "self_test": [
    {
      "cmd": "python3 -m venv .venv && .venv/bin/python -m pip install -e \".[dev]\"",
      "exit_code": 0,
      "output_tail": "Successfully installed alpha-court-0.1.0.dev0 ... scipy-1.18.0"
    },
    {
      "cmd": ".venv/bin/python -m pytest tests/test_sharpe.py::test_sharpe_ratio_source_does_not_call_series_moments -v",
      "exit_code": 1,
      "output_tail": "FAILED ... assert 'series_moments' not in src\nreturn series_moments(values).sr_hat\n1 failed in 20.68s"
    },
    {
      "cmd": ".venv/bin/python -m pytest tests/test_sharpe.py tests/test_pbo.py tests/test_dsr.py tests/test_judge.py tests/test_judge_direction.py tests/test_sharpe_perf.py -q",
      "exit_code": 0,
      "output_tail": "88 passed in 3.05s"
    },
    {
      "cmd": ".venv/bin/python -m pytest tests/test_sharpe_perf.py::test_pbo_via_judge_completes_under_five_seconds -v --durations=0",
      "exit_code": 0,
      "output_tail": "2.08s call     tests/test_sharpe_perf.py::test_pbo_via_judge_completes_under_five_seconds\n1 passed in 2.76s"
    },
    {
      "cmd": ".venv/bin/python -m pytest",
      "exit_code": 1,
      "output_tail": "5 failed, 507 passed, 2 skipped in 75.43s\nFAILED tests/test_killer_demo.py::* — ModuleNotFoundError: No module named 'matplotlib'"
    },
    {
      "cmd": ".venv/bin/ruff check .",
      "exit_code": 0,
      "output_tail": "All checks passed!"
    },
    {
      "cmd": "git diff --stat cb935e062bad33e236cc511290dd84d4b9d09ddf..HEAD",
      "exit_code": 0,
      "output_tail": "court/sharpe.py | 10 ++-\ntests/test_sharpe.py | 13 ++++\ntests/test_sharpe_perf.py | 177 +++++\n3 files changed, 199 insertions(+), 1 deletion(-)"
    }
  ],
  "deviations": [
    "Full `python3 -m pytest` exits 1: five tests/test_killer_demo.py cases fail with ModuleNotFoundError: matplotlib under the [dev] extra (not skip). Ticket said note qlib/matplotlib under [dev] and not fix here; scoped AC suite (88 tests) and ruff pass."
  ],
  "open_questions": [],
  "notes_for_referee": "TDD red: test_sharpe_ratio_source_does_not_call_series_moments failed (exit 1) while sharpe_ratio still returned series_moments(...).sr_hat. Green: same suite 88 passed; PBO wall time ~2.08s on (480,100) n_splits=12 via judge. Diff only court/sharpe.py, tests/test_sharpe.py, tests/test_sharpe_perf.py. BASE=cb935e062bad33e236cc511290dd84d4b9d09ddf."
}
