{
  "ticket_id": "v0.3-00b",
  "status": "done",
  "summary": "Added blade_roster declaration helpers in harness/blades.py: BLADE_ROSTER_KIND, roster_entry (sha256 of sorted-keys compact JSON of getattr(blade, 'roster_params', {})), append_blade_roster (unique), and find_blade_roster (first roster list or None). CertifiedRun.evaluate now fail-closes when blades are missing but a roster is pinned, and when a bladeless ledger's trial spec declares on_flag screen. _apply_blades auto-pins the attached roster after the calibration and on_flag checks and before blades run, and refuses a name/fingerprint sequence mismatch. tests/test_blades_roster.py covers P3, P3b, auto-pin, mismatch vs equivalent instance, uniqueness, seal+verify, and the bladeless regression.",
  "branch": "dispatch/v0.3-00b-blade-roster-20260813-215738",
  "commit": "80eaf486629eb7c3d2946a66d260a57b0fa6b81a",
  "worktree_path": "[HOME]/.alpha-court/dispatch-worktrees/v0.3-00b-blade-roster-20260813-215738",
  "files_changed": [
    {
      "path": "harness/blades.py",
      "action": "modified",
      "purpose": "Add blade_roster kind, fingerprint helper, unique append, and first-match finder."
    },
    {
      "path": "harness/run.py",
      "action": "modified",
      "purpose": "Auto-pin and cross-check the roster in _apply_blades; lock bladeless evaluate against pinned roster and screen declarations."
    },
    {
      "path": "tests/test_blades_roster.py",
      "action": "added",
      "purpose": "Red-first coverage of P3/P3b, auto-pin, mismatch, uniqueness, e2e verify, and bladeless regression."
    }
  ],
  "self_test": [
    {
      "cmd": "python3 -m pytest tests/test_blades_roster.py -v",
      "exit_code": 1,
      "output_tail": "FAILED tests/test_blades_roster.py::test_p3_bladeless_open_refuses_screened_trial_equivalent_reopen_stays_terminal\nFAILED tests/test_blades_roster.py::test_p3b_bladeless_create_refuses_spec_screen_declaration\nFAILED tests/test_blades_roster.py::test_auto_pin_first_bladed_evaluate_appends_exactly_one_matching_roster\nFAILED tests/test_blades_roster.py::test_reopen_mismatch_refused_equivalent_instance_accepted\nFAILED tests/test_blades_roster.py::test_append_blade_roster_uniqueness_raises_on_second\nFAILED tests/test_blades_roster.py::test_bladed_run_with_roster_calibration_reports_seals_and_verifies\nFAILED tests/test_blades_roster.py::test_bladeless_run_without_screen_records_as_before\n============================== 7 failed in 1.96s ==============================="
    },
    {
      "cmd": "python3 -m pytest tests/test_blades_roster.py -v",
      "exit_code": 0,
      "output_tail": "tests/test_blades_roster.py::test_p3b_bladeless_create_refuses_spec_screen_declaration PASSED [ 28%]\ntests/test_blades_roster.py::test_auto_pin_first_bladed_evaluate_appends_exactly_one_matching_roster PASSED [ 42%]\ntests/test_blades_roster.py::test_reopen_mismatch_refused_equivalent_instance_accepted PASSED [ 57%]\ntests/test_blades_roster.py::test_append_blade_roster_uniqueness_raises_on_second PASSED [ 71%]\ntests/test_blades_roster.py::test_bladed_run_with_roster_calibration_reports_seals_and_verifies PASSED [ 85%]\ntests/test_blades_roster.py::test_bladeless_run_without_screen_records_as_before PASSED [100%]\n\n============================== 7 passed in 1.19s ==============================="
    },
    {
      "cmd": "python3 -m pytest tests/test_blades_harness.py -q",
      "exit_code": 0,
      "output_tail": "...................                                                      [100%]\n19 passed in 1.14s"
    },
    {
      "cmd": "python3 -m pytest -q",
      "exit_code": 0,
      "output_tail": "........................................................................ [ 91%]\n.....................................................                    [100%]\n628 passed, 2 skipped in 118.27s (0:01:58)"
    },
    {
      "cmd": "ruff check .",
      "exit_code": 0,
      "output_tail": "All checks passed!"
    }
  ],
  "deviations": [],
  "open_questions": [],
  "notes_for_referee": "TDD red is the first self_test entry (7 failed: missing helpers plus the two new evaluate locks). Bladeless-history lock is checked before the screened-terminality guard so P3 without blades raises the pinned-roster error; with equivalent blades it still hits the existing screened guard. Auto-pin runs after calibration and on_flag checks and before blade.run, so invalid on_flag still appends nothing. Full suite did not hit the three known wall-clock perf failures on this machine."
}
