{
  "ticket_id": "v0.3-02",
  "status": "done",
  "summary": "Added MagnitudeVsTurnoverBlade in gates/magnitude_vs_turnover.py: net(c) = mean_gross − c·tau, flag iff E[net] ≤ 0 at spec c_ref, with a cost-grid table and signed break-even c* (None when tau == 0). Missing/invalid turnover or c_ref and empty series take the evaluable=False path (flagged=False, JSON-safe, no raise). Tests in tests/test_gates_magnitude.py cover the hand vector, grid, break-even, invalid inputs, constructor, CertifiedRun screen/record smoke, and determinism. gates/ still has no court/harness imports.",
  "branch": "dispatch/v0.3-02-magnitude-turnover-20260813-170932",
  "commit": "c141ee3d945bff3444d8483f4e7902a4cd6e0691",
  "worktree_path": "[HOME]/.alpha-court/dispatch-worktrees/v0.3-02-magnitude-turnover-20260813-170932",
  "files_changed": [
    {
      "path": "gates/magnitude_vs_turnover.py",
      "action": "added",
      "purpose": "Pure economic-floor blade: net(c)=mean_gross−c·tau, flag at c_ref, no significance stats."
    },
    {
      "path": "tests/test_gates_magnitude.py",
      "action": "added",
      "purpose": "Red-first unit and CertifiedRun integration tests for the magnitude_vs_turnover blade."
    }
  ],
  "self_test": [
    {
      "cmd": "python3 -m pytest tests/test_gates_magnitude.py -v --tb=line",
      "exit_code": 2,
      "output_tail": "tests/test_gates_magnitude.py:20: in <module>\n    from gates.magnitude_vs_turnover import MagnitudeVsTurnoverBlade\nE   ModuleNotFoundError: No module named 'gates.magnitude_vs_turnover'\n=========================== short test summary info ============================\nERROR tests/test_gates_magnitude.py\n!!!!!!!!!!!!!!!!!!!! Interrupted: 1 error during collection !!!!!!!!!!!!!!!!!!!!\n============================== 1 error in 19.47s ==============================="
    },
    {
      "cmd": "python3 -m pytest tests/test_gates_magnitude.py -v --tb=short",
      "exit_code": 0,
      "output_tail": "tests/test_gates_magnitude.py::test_constructor_non_increasing_raises PASSED [ 81%]\ntests/test_gates_magnitude.py::test_identical_report_on_repeat_call PASSED [ 87%]\ntests/test_gates_magnitude.py::test_screen_on_flag_leaves_trial_registered_with_flagged_report PASSED [ 93%]\ntests/test_gates_magnitude.py::test_default_on_flag_records_when_spec_silent PASSED [100%]\n\n============================== 16 passed in 4.62s =============================="
    },
    {
      "cmd": "python3 -m pytest -q",
      "exit_code": 1,
      "output_tail": "E       AssertionError: PBO via judge took 5.609s (need < 5.0s)\nE       assert 5.609184458851814 < 5.0\n\ntests/test_sharpe_perf.py:177: AssertionError\n=========================== short test summary info ============================\nFAILED tests/test_adapter_kernel_perf.py::test_evaluate_shifted_ic_dense_panel_under_3s\nFAILED tests/test_adapter_kernel_perf.py::test_evaluate_shifted_ic_churn_panel_under_5s\nFAILED tests/test_sharpe_perf.py::test_pbo_via_judge_completes_under_five_seconds\n3 failed, 596 passed, 2 skipped in 417.90s (0:06:57)"
    },
    {
      "cmd": "python3 -m pytest tests/test_adapter_kernel_perf.py::test_evaluate_shifted_ic_dense_panel_under_3s tests/test_adapter_kernel_perf.py::test_evaluate_shifted_ic_churn_panel_under_5s tests/test_sharpe_perf.py::test_pbo_via_judge_completes_under_five_seconds -v --tb=line",
      "exit_code": 1,
      "output_tail": "E   AssertionError: evaluate_shifted(199) took 3.351s (budget 3.0s)\n    assert 3.35121783381328 < 3.0\n[HOME]/.alpha-court/dispatch-worktrees/v0.3-02-magnitude-turnover-20260813-170932/tests/test_adapter_kernel_perf.py:269: AssertionError: evaluate_shifted(199) took 3.351s (budget 3.0s)\n=========================== short test summary info ============================\nFAILED tests/test_adapter_kernel_perf.py::test_evaluate_shifted_ic_dense_panel_under_3s\n========================= 1 failed, 2 passed in 18.32s ========================="
    },
    {
      "cmd": "python3 -m ruff check .",
      "exit_code": 0,
      "output_tail": "All checks passed!"
    }
  ],
  "deviations": [
    "python3 -m pytest -q exited 1 solely on the three documented wall-clock perf tests (test_adapter_kernel_perf.py ×2, test_sharpe_perf.py ×1). Isolated re-run: churn and PBO passed; dense panel still 3.351s vs 3.0s budget. Product tests (16/16) and ruff are clean; ownership vs BASE 180987930cc667183eab0b09311f57005bc6eb9d is the two allowed files."
  ],
  "open_questions": [
    "Happy-path statistics include evaluable=True (ticket only mandated evaluable=False on the inevaluable path).",
    "n_obs is a Python int; other numeric statistics are Python floats.",
    "Negative c_ref is accepted (ticket listed negative tau as invalid, not negative c_ref)."
  ],
  "notes_for_referee": "BASE before first commit: 180987930cc667183eab0b09311f57005bc6eb9d. TDD red was collection ModuleNotFoundError (exit 2) before gates/magnitude_vs_turnover.py existed. Full-suite failures match the ticket's loaded-machine caveat; isolated re-run left only the dense-panel 3s budget failing."
}
